{
  "schema_version": "1.0",
  "approval_id": "6f7a8b9c-adbe-4f6a-9b7c-8d9eafb0c1d2",
  "task_id": "2b3c4d5e-6f7a-4b2c-9d3e-4f5a6b7c8d9e",
  "action_id": "4d5e6f7a-8b9c-4d4e-bf5a-6b7c8d9eafb0",
  "requested_by": "runtime",
  "action_type": "commerce.purchase",
  "destination": "vendor:example-store.test",
  "params_hash": "aaaaaaaaaaaaaaaaaaaaaaaaaaaaaaaaaaaaaaaaaaaaaaaaaaaaaaaaaaaaaaaa",
  "max_cost": {
    "amount_minor": 12990,
    "currency": "BRL"
  },
  "recurrence": "ONCE",
  "expires_at": "2026-09-23T12:00:00.000Z",
  "max_uses": 1,
  "uses": 0,
  "policy_version": "policy-2026.09.1",
  "risk_class": "R4",
  "status": "PENDING",
  "created_at": "2026-09-22T12:00:00.000Z",
  "decided_at": null,
  "decided_by": null,
  "nonce": "0123456789abcdef0123456789abcdef",
  "purchase": {
    "vendor": "Example Store (synthetic)",
    "items": [
      "Licenca anual sintetica"
    ],
    "known_fees": [
      {
        "amount_minor": 990,
        "currency": "BRL"
      }
    ],
    "material_terms": "Renovacao automatica desligada"
  }
}
